Bus Hound 6.01 capture on Windows Vista (x64). Complements of www.perisoft.net

  Device - Device ID (followed by the endpoint for USB devices)
            (37) USB CH372/CH375
            (44) USB Serial Port
  Phase  - Phase Type
            IN    Data in transfer           
            OUT   Data out transfer          
  Data   - Hex dump of the data transferred
  Descr  - Description of the phase
  Cmd... - Position in the captured data


Device  Phase  Data                                                Description       Cmd.Phase.Ofs(rep)
------  -----  --------------------------------------------------  ----------------  ------------------
  37.2  OUT    7e 7e 01 00  fb 00 00 55  aa 00 00 00  00 00 00 00  .......U........         1.1.0        
  37.2  IN     e7 e7 00 00  0f 02 00 fb  e7 55 aa 00  00 00 00 00  .........U......         2.1.0        
  37.2  OUT    7e 7e 01 00  fe 00 00 55  aa 00 00 00  00 00 00 00  .......U........         3.1.0        
  37.2  IN     e7 e7 00 00  0f 02 00 fe  e7 55 aa 00  00 00 00 00  .........U......         4.1.0        
  37.2  OUT    7e 7e 01 00  fd 00 00 55  aa 00 00 00  00 00 00 00  .......U........         5.1.0        
  37.2  IN     e7 e7 00 00  0f 02 00 fd  e7 55 aa 00  00 00 00 00  .........U......         6.1.0        
  37.2  OUT    7e 7e 01 00  00 00 00 55  aa 00 00 00  00 00 00 00  .......U........         7.1.0(3)     
  37.2  OUT    7e 7e 01 00  7e 00 00 55  aa 00 00 00  00 00 00 00  .......U........        10.1.0        
  37.2  OUT    7e 7e 01 00  a4 00 00 55  aa 00 00 00  00 00 00 00  .......U........        11.1.0        
  37.2  OUT    7e 7e 01 00  8c 00 00 55  aa 00 00 00  00 00 00 00  .......U........        12.1.0        
  37.2  OUT    7e 7e 01 00  b2 00 00 55  aa 00 00 00  00 00 00 00  .......U........        13.1.0        
  37.2  OUT    7e 7e 01 00  bd 00 00 55  aa 00 00 00  00 00 00 00  .......U........        14.1.0        
  37.2  OUT    7e 7e 01 00  fe 00 00 55  aa 00 00 00  00 00 00 00  .......U........        15.1.0        
  37.2  OUT    7e 7e 01 00  04 00 00 55  aa 00 00 00  00 00 00 00  .......U........        16.1.0        
  37.2  OUT    7e 7e 01 00  76 00 00 55  aa 00 00 00  00 00 00 00  ....v..U........        17.1.0        
  37.2  OUT    7e 7e 01 00  1f 00 00 55  aa 00 00 00  00 00 00 00  .......U........        18.1.0        
  37.2  OUT    7e 7e 01 00  02 00 00 55  aa 00 00 00  00 00 00 00  .......U........        19.1.0        
  37.2  OUT    7e 7e 01 00  01 00 00 55  aa 00 00 00  00 00 00 00  .......U........        20.1.0        
  37.2  OUT    7e 7e 01 00  96 00 00 55  aa 00 00 00  00 00 00 00  .......U........        21.1.0        
  37.2  OUT    7e 7e 01 00  43 00 00 55  aa 00 00 00  00 00 00 00  ....C..U........        22.1.0        
  37.2  OUT    7e 7e 01 00  02 00 00 55  aa 00 00 00  00 00 00 00  .......U........        23.1.0        
  37.2  OUT    7e 7e 01 00  00 00 00 55  aa 00 00 00  00 00 00 00  .......U........        24.1.0        
  37.2  OUT    7e 7e 01 00  1e 00 00 55  aa 00 00 00  00 00 00 00  .......U........        25.1.0        
  37.2  OUT    7e 7e 01 00  1a 00 00 55  aa 00 00 00  00 00 00 00  .......U........        26.1.0        
  37.2  OUT    7e 7e 01 00  76 00 00 55  aa 00 00 00  00 00 00 00  ....v..U........        27.1.0        
  37.2  OUT    7e 7e 01 00  22 00 00 55  aa 00 00 00  00 00 00 00  ...."..U........        28.1.0        
  37.2  OUT    7e 7e 01 00  76 00 00 55  aa 00 00 00  00 00 00 00  ....v..U........        29.1.0        
  37.2  OUT    7e 7e 01 00  1f 00 00 55  aa 00 00 00  00 00 00 00  .......U........        30.1.0        
  37.2  OUT    7e 7e 01 00  01 00 00 55  aa 00 00 00  00 00 00 00  .......U........        31.1.0        
  37.2  OUT    7e 7e 01 00  c0 00 00 55  aa 00 00 00  00 00 00 00  .......U........        32.1.0        
  37.2  OUT    7e 7e 01 00  1a 00 00 55  aa 00 00 00  00 00 00 00  .......U........        33.1.0        
  37.2  OUT    7e 7e 01 00  1c 00 00 55  aa 00 00 00  00 00 00 00  .......U........        34.1.0        
  37.2  OUT    7e 7e 01 00  00 00 00 55  aa 00 00 00  00 00 00 00  .......U........        35.1.0        
  37.2  OUT    7e 7e 01 00  08 00 00 55  aa 00 00 00  00 00 00 00  .......U........        36.1.0        
  37.2  OUT    7e 7e 01 00  76 00 00 55  aa 00 00 00  00 00 00 00  ....v..U........        37.1.0        
  37.2  OUT    7e 7e 01 00  1a 00 00 55  aa 00 00 00  00 00 00 00  .......U........        38.1.0        
  37.2  OUT    7e 7e 01 00  92 00 00 55  aa 00 00 00  00 00 00 00  .......U........        39.1.0        
  37.2  OUT    7e 7e 01 00  43 00 00 55  aa 00 00 00  00 00 00 00  ....C..U........        40.1.0        
  37.2  OUT    7e 7e 01 00  52 00 00 55  aa 00 00 00  00 00 00 00  ....R..U........        41.1.0        
  37.2  OUT    7e 7e 01 00  01 00 00 55  aa 00 00 00  00 00 00 00  .......U........        42.1.0        
  37.2  OUT    7e 7e 01 00  ec 00 00 55  aa 00 00 00  00 00 00 00  .......U........        43.1.0        
  37.2  OUT    7e 7e 01 00  03 00 00 55  aa 00 00 00  00 00 00 00  .......U........        44.1.0        
  37.2  OUT    7e 7e 01 00  52 00 00 55  aa 00 00 00  00 00 00 00  ....R..U........        45.1.0        
  37.2  OUT    7e 7e 01 00  02 00 00 55  aa 00 00 00  00 00 00 00  .......U........        46.1.0        
  37.2  OUT    7e 7e 01 00  ed 00 00 55  aa 00 00 00  00 00 00 00  .......U........        47.1.0        
  37.2  OUT    7e 7e 01 00  21 00 00 55  aa 00 00 00  00 00 00 00  ....!..U........        48.1.0        
  37.2  OUT    7e 7e 01 00  76 00 00 55  aa 00 00 00  00 00 00 00  ....v..U........        49.1.0        
  37.2  OUT    7e 7e 01 00  1f 00 00 55  aa 00 00 00  00 00 00 00  .......U........        50.1.0        
  37.2  OUT    7e 7e 01 00  01 00 00 55  aa 00 00 00  00 00 00 00  .......U........        51.1.0        
  37.2  OUT    7e 7e 01 00  c4 00 00 55  aa 00 00 00  00 00 00 00  .......U........        52.1.0        
  37.2  OUT    7e 7e 01 00  1a 00 00 55  aa 00 00 00  00 00 00 00  .......U........        53.1.0        
  37.2  OUT    7e 7e 01 00  18 00 00 55  aa 00 00 00  00 00 00 00  .......U........        54.1.0        
  37.2  OUT    7e 7e 01 00  00 00 00 55  aa 00 00 00  00 00 00 00  .......U........        55.1.0        
  37.2  OUT    7e 7e 01 00  20 00 00 55  aa 00 00 00  00 00 00 00  .... ..U........        56.1.0        
  37.2  OUT    7e 7e 01 00  cc 00 00 55  aa 00 00 00  00 00 00 00  .......U........        57.1.0        
  37.2  OUT    7e 7e 01 00  18 00 00 55  aa 00 00 00  00 00 00 00  .......U........        58.1.0        
  37.2  OUT    7e 7e 01 00  ff 00 00 55  aa 00 00 00  00 00 00 00  .......U........        59.1.0        
  37.2  OUT    7e 7e 01 00  e1 00 00 55  aa 00 00 00  00 00 00 00  .......U........        60.1.0        
  37.2  OUT    7e 7e 01 00  50 00 00 55  aa 00 00 00  00 00 00 00  ....P..U........        61.1.0        
  37.2  OUT    7e 7e 01 00  02 00 00 55  aa 00 00 00  00 00 00 00  .......U........        62.1.0        
  37.2  OUT    7e 7e 01 00  96 00 00 55  aa 00 00 00  00 00 00 00  .......U........        63.1.0        
  37.2  OUT    7e 7e 01 00  18 00 00 55  aa 00 00 00  00 00 00 00  .......U........        64.1.0(2)     
  37.2  OUT    7e 7e 01 00  00 00 00 55  aa 00 00 00  00 00 00 00  .......U........        66.1.0        
  37.2  OUT    7e 7e 01 00  ff 00 00 55  aa 00 00 00  00 00 00 00  .......U........        67.1.0        
  37.2  OUT    7e 7e 01 00  7f 00 00 55  aa 00 00 00  00 00 00 00  .......U........        68.1.0        
  37.2  OUT    7e 7e 01 00  18 00 00 55  aa 00 00 00  00 00 00 00  .......U........        69.1.0(2)     
  37.2  OUT    7e 7e 01 00  ff 00 00 55  aa 00 00 00  00 00 00 00  .......U........        71.1.0        
  37.2  OUT    7e 7e 01 00  fe 00 00 55  aa 00 00 00  00 00 00 00  .......U........        72.1.0        
  37.2  OUT    7e 7e 01 00  18 00 00 55  aa 00 00 00  00 00 00 00  .......U........        73.1.0        
  37.2  OUT    7e 7e 01 00  02 00 00 55  aa 00 00 00  00 00 00 00  .......U........        74.1.0        
  37.2  OUT    7e 7e 01 00  ff 00 00 55  aa 00 00 00  00 00 00 00  .......U........        75.1.0        
  37.2  OUT    7e 7e 01 00  80 00 00 55  aa 00 00 00  00 00 00 00  .......U........        76.1.0        
  37.2  OUT    7e 7e 01 00  18 00 00 55  aa 00 00 00  00 00 00 00  .......U........        77.1.0        
  37.2  OUT    7e 7e 01 00  03 00 00 55  aa 00 00 00  00 00 00 00  .......U........        78.1.0        
  37.2  OUT    7e 7e 01 00  ff 00 00 55  aa 00 00 00  00 00 00 00  .......U........        79.1.0        
  37.2  OUT    7e 7e 01 00  f0 00 00 55  aa 00 00 00  00 00 00 00  .......U........        80.1.0        
  37.2  OUT    7e 7e 01 00  1a 00 00 55  aa 00 00 00  00 00 00 00  .......U........        81.1.0        
  37.2  OUT    7e 7e 01 00  19 00 00 55  aa 00 00 00  00 00 00 00  .......U........        82.1.0        
  37.2  OUT    7e 7e 01 00  00 00 00 55  aa 00 00 00  00 00 00 00  .......U........        83.1.0        
  37.2  OUT    7e 7e 01 00  10 00 00 55  aa 00 00 00  00 00 00 00  .......U........        84.1.0        
  37.2  OUT    7e 7e 01 00  1a 00 00 55  aa 00 00 00  00 00 00 00  .......U........        85.1.0        
  37.2  OUT    7e 7e 01 00  19 00 00 55  aa 00 00 00  00 00 00 00  .......U........        86.1.0        
  37.2  OUT    7e 7e 01 00  00 00 00 55  aa 00 00 00  00 00 00 00  .......U........        87.1.0        
  37.2  OUT    7e 7e 01 00  20 00 00 55  aa 00 00 00  00 00 00 00  .... ..U........        88.1.0        
  37.2  OUT    7e 7e 01 00  18 00 00 55  aa 00 00 00  00 00 00 00  .......U........        89.1.0        
  37.2  OUT    7e 7e 01 00  01 00 00 55  aa 00 00 00  00 00 00 00  .......U........        90.1.0        
  37.2  OUT    7e 7e 01 00  7f 00 00 55  aa 00 00 00  00 00 00 00  .......U........        91.1.0        
  37.2  OUT    7e 7e 01 00  ff 00 00 55  aa 00 00 00  00 00 00 00  .......U........        92.1.0        
  37.2  OUT    7e 7e 01 00  1a 00 00 55  aa 00 00 00  00 00 00 00  .......U........        93.1.0        
  37.2  OUT    7e 7e 01 00  01 00 00 55  aa 00 00 00  00 00 00 00  .......U........        94.1.0        
  37.2  OUT    7e 7e 01 00  40 00 00 55  aa 00 00 00  00 00 00 00  ....@..U........        95.1.0        
  37.2  OUT    7e 7e 01 00  00 00 00 55  aa 00 00 00  00 00 00 00  .......U........        96.1.0        
  37.2  OUT    7e 7e 01 00  18 00 00 55  aa 00 00 00  00 00 00 00  .......U........        97.1.0        
  37.2  OUT    7e 7e 01 00  01 00 00 55  aa 00 00 00  00 00 00 00  .......U........        98.1.0        
  37.2  OUT    7e 7e 01 00  f7 00 00 55  aa 00 00 00  00 00 00 00  .......U........        99.1.0        
  37.2  OUT    7e 7e 01 00  ff 00 00 55  aa 00 00 00  00 00 00 00  .......U........       100.1.0        
  37.2  OUT    7e 7e 01 00  18 00 00 55  aa 00 00 00  00 00 00 00  .......U........       101.1.0        
  37.2  OUT    7e 7e 01 00  01 00 00 55  aa 00 00 00  00 00 00 00  .......U........       102.1.0        
  37.2  OUT    7e 7e 01 00  fb 00 00 55  aa 00 00 00  00 00 00 00  .......U........       103.1.0        
  37.2  OUT    7e 7e 01 00  ff 00 00 55  aa 00 00 00  00 00 00 00  .......U........       104.1.0        
  37.2  OUT    7e 7e 01 00  18 00 00 55  aa 00 00 00  00 00 00 00  .......U........       105.1.0        
  37.2  OUT    7e 7e 01 00  01 00 00 55  aa 00 00 00  00 00 00 00  .......U........       106.1.0        
  37.2  OUT    7e 7e 01 00  fe 00 00 55  aa 00 00 00  00 00 00 00  .......U........       107.1.0        
  37.2  OUT    7e 7e 01 00  ff 00 00 55  aa 00 00 00  00 00 00 00  .......U........       108.1.0        
  37.2  OUT    7e 7e 01 00  18 00 00 55  aa 00 00 00  00 00 00 00  .......U........       109.1.0        
  37.2  OUT    7e 7e 01 00  01 00 00 55  aa 00 00 00  00 00 00 00  .......U........       110.1.0        
  37.2  OUT    7e 7e 01 00  ff 00 00 55  aa 00 00 00  00 00 00 00  .......U........       111.1.0        
  37.2  OUT    7e 7e 01 00  7f 00 00 55  aa 00 00 00  00 00 00 00  .......U........       112.1.0        
  37.2  OUT    7e 7e 01 00  3b 00 00 55  aa 00 00 00  00 00 00 00  ....;..U........       113.1.0        
  37.2  OUT    7e 7e 01 00  10 00 00 55  aa 00 00 00  00 00 00 00  .......U........       114.1.0        
  37.2  OUT    7e 7e 01 00  6f 00 00 55  aa 00 00 00  00 00 00 00  ....o..U........       115.1.0        
  37.2  OUT    7e 7e 01 00  0f 00 00 55  aa 00 00 00  00 00 00 00  .......U........       116.1.0        
  37.2  OUT    7e 7e 01 00  76 00 00 55  aa 00 00 00  00 00 00 00  ....v..U........       117.1.0        
  37.2  OUT    7e 7e 01 00  1f 00 00 55  aa 00 00 00  00 00 00 00  .......U........       118.1.0        
  37.2  OUT    7e 7e 01 00  01 00 00 55  aa 00 00 00  00 00 00 00  .......U........       119.1.0        
  37.2  OUT    7e 7e 01 00  c3 00 00 55  aa 00 00 00  00 00 00 00  .......U........       120.1.0        
  37.2  OUT    7e 7e 01 00  18 00 00 55  aa 00 00 00  00 00 00 00  .......U........       121.1.0        
  37.2  OUT    7e 7e 01 00  34 00 00 55  aa 00 00 00  00 00 00 00  ....4..U........       122.1.0        
  37.2  OUT    7e 7e 01 00  fd 00 00 55  aa 00 00 00  00 00 00 00  .......U........       123.1.0        
  37.2  OUT    7e 7e 01 00  ff 00 00 55  aa 00 00 00  00 00 00 00  .......U........       124.1.0        
  37.2  OUT    7e 7e 01 00  6f 00 00 55  aa 00 00 00  00 00 00 00  ....o..U........       125.1.0        
  37.2  OUT    7e 7e 01 00  05 00 00 55  aa 00 00 00  00 00 00 00  .......U........       126.1.0        
  37.2  OUT    7e 7e 01 00  76 00 00 55  aa 00 00 00  00 00 00 00  ....v..U........       127.1.0        
  37.2  OUT    7e 7e 01 00  1f 00 00 55  aa 00 00 00  00 00 00 00  .......U........       128.1.0        
  37.2  OUT    7e 7e 01 00  01 00 00 55  aa 00 00 00  00 00 00 00  .......U........       129.1.0        
  37.2  OUT    7e 7e 01 00  c3 00 00 55  aa 00 00 00  00 00 00 00  .......U........       130.1.0        
  37.2  OUT    7e 7e 01 00  1a 00 00 55  aa 00 00 00  00 00 00 00  .......U........       131.1.0        
  37.2  OUT    7e 7e 01 00  34 00 00 55  aa 00 00 00  00 00 00 00  ....4..U........       132.1.0        
  37.2  OUT    7e 7e 01 00  02 00 00 55  aa 00 00 00  00 00 00 00  .......U........       133.1.0        
  37.2  OUT    7e 7e 01 00  00 00 00 55  aa 00 00 00  00 00 00 00  .......U........       134.1.0        
  37.2  OUT    7e 7e 01 00  18 00 00 55  aa 00 00 00  00 00 00 00  .......U........       135.1.0        
  37.2  OUT    7e 7e 01 00  34 00 00 55  aa 00 00 00  00 00 00 00  ....4..U........       136.1.0        
  37.2  OUT    7e 7e 01 00  fe 00 00 55  aa 00 00 00  00 00 00 00  .......U........       137.1.0        
  37.2  OUT    7e 7e 01 00  ff 00 00 55  aa 00 00 00  00 00 00 00  .......U........       138.1.0        
  37.2  OUT    7e 7e 01 00  1a 00 00 55  aa 00 00 00  00 00 00 00  .......U........       139.1.0        
  37.2  OUT    7e 7e 01 00  34 00 00 55  aa 00 00 00  00 00 00 00  ....4..U........       140.1.0        
  37.2  OUT    7e 7e 01 00  04 00 00 55  aa 00 00 00  00 00 00 00  .......U........       141.1.0        
  37.2  OUT    7e 7e 01 00  00 00 00 55  aa 00 00 00  00 00 00 00  .......U........       142.1.0        
  37.2  OUT    7e 7e 01 00  6f 00 00 55  aa 00 00 00  00 00 00 00  ....o..U........       143.1.0        
  37.2  OUT    7e 7e 01 00  08 00 00 55  aa 00 00 00  00 00 00 00  .......U........       144.1.0        
  37.2  OUT    7e 7e 01 00  92 00 00 55  aa 00 00 00  00 00 00 00  .......U........       145.1.0        
  37.2  OUT    7e 7e 01 00  43 00 00 55  aa 00 00 00  00 00 00 00  ....C..U........       146.1.0        
  37.2  OUT    7e 7e 01 00  52 00 00 55  aa 00 00 00  00 00 00 00  ....R..U........       147.1.0        
  37.2  OUT    7e 7e 01 00  01 00 00 55  aa 00 00 00  00 00 00 00  .......U........       148.1.0        
  37.2  OUT    7e 7e 01 00  ec 00 00 55  aa 00 00 00  00 00 00 00  .......U........       149.1.0        
  37.2  OUT    7e 7e 01 00  f0 00 00 55  aa 00 00 00  00 00 00 00  .......U........       150.1.0        
  37.2  OUT    7e 7e 01 00  52 00 00 55  aa 00 00 00  00 00 00 00  ....R..U........       151.1.0        
  37.2  OUT    7e 7e 01 00  02 00 00 55  aa 00 00 00  00 00 00 00  .......U........       152.1.0        
  37.2  OUT    7e 7e 01 00  ec 00 00 55  aa 00 00 00  00 00 00 00  .......U........       153.1.0        
  37.2  OUT    7e 7e 01 00  f3 00 00 55  aa 00 00 00  00 00 00 00  .......U........       154.1.0        
  37.2  OUT    7e 7e 01 00  ff 00 00 55  aa 00 00 00  00 00 00 00  .......U........       155.1.0        
  37.2  OUT    7e 7e 01 00  ef 00 00 55  aa 00 00 00  00 00 00 00  .......U........       156.1.0        
  37.2  OUT    7e 7e 01 00  02 00 00 55  aa 00 00 00  00 00 00 00  .......U........       157.1.0        
  37.2  OUT    7e 7e 01 00  85 00 00 55  aa 00 00 00  00 00 00 00  .......U........       158.1.0        
  37.2  OUT    7e 7e 01 00  18 00 00 55  aa 00 00 00  00 00 00 00  .......U........       159.1.0(7)     
  37.2  OUT    7e 7e 01 00  34 00 00 55  aa 00 00 00  00 00 00 00  ....4..U........       160.1.0(7)     
  37.2  OUT    7e 7e 01 00  ff 00 00 55  aa 00 00 00  00 00 00 00  .......U........       161.1.0(7)     
  37.2  OUT    7e 7e 01 00  f7 00 00 55  aa 00 00 00  00 00 00 00  .......U........       162.1.0(7)     
  37.2  OUT    7e 7e 01 00  18 00 00 55  aa 00 00 00  00 00 00 00  .......U........       163.1.0(7)     
  37.2  OUT    7e 7e 01 00  34 00 00 55  aa 00 00 00  00 00 00 00  ....4..U........       164.1.0(7)     
  37.2  OUT    7e 7e 01 00  ff 00 00 55  aa 00 00 00  00 00 00 00  .......U........       165.1.0(7)     
  37.2  OUT    7e 7e 01 00  fb 00 00 55  aa 00 00 00  00 00 00 00  .......U........       166.1.0(7)     
  37.2  OUT    7e 7e 01 00  18 00 00 55  aa 00 00 00  00 00 00 00  .......U........       215.1.0        
  37.2  OUT    7e 7e 01 00  34 00 00 55  aa 00 00 00  00 00 00 00  ....4..U........       216.1.0        
  37.2  OUT    7e 7e 01 00  ff 00 00 55  aa 00 00 00  00 00 00 00  .......U........       217.1.0        
  37.2  OUT    7e 7e 01 00  f7 00 00 55  aa 00 00 00  00 00 00 00  .......U........       218.1.0        
  37.2  OUT    7e 7e 01 00  1a 00 00 55  aa 00 00 00  00 00 00 00  .......U........       219.1.0        
  37.2  OUT    7e 7e 01 00  34 00 00 55  aa 00 00 00  00 00 00 00  ....4..U........       220.1.0        
  37.2  OUT    7e 7e 01 00  00 00 00 55  aa 00 00 00  00 00 00 00  .......U........       221.1.0        
  37.2  OUT    7e 7e 01 00  04 00 00 55  aa 00 00 00  00 00 00 00  .......U........       222.1.0        
  37.2  OUT    7e 7e 01 00  f6 00 00 55  aa 00 00 00  00 00 00 00  .......U........       223.1.0        
  37.2  OUT    7e 7e 01 00  15 00 00 55  aa 00 00 00  00 00 00 00  .......U........       224.1.0        
  37.2  OUT    7e 7e 01 00  77 00 00 55  aa 00 00 00  00 00 00 00  ....w..U........       225.1.0        
  37.2  OUT    7e 7e 01 00  00 00 00 55  aa 00 00 00  00 00 00 00  .......U........       226.1.0        
  37.2  OUT    7e 7e 01 00  18 00 00 55  aa 00 00 00  00 00 00 00  .......U........       227.1.0        
  37.2  OUT    7e 7e 01 00  34 00 00 55  aa 00 00 00  00 00 00 00  ....4..U........       228.1.0        
  37.2  OUT    7e 7e 01 00  ff 00 00 55  aa 00 00 00  00 00 00 00  .......U........       229.1.0        
  37.2  OUT    7e 7e 01 00  fb 00 00 55  aa 00 00 00  00 00 00 00  .......U........       230.1.0        
  37.2  OUT    7e 7e 01 00  1a 00 00 55  aa 00 00 00  00 00 00 00  .......U........       231.1.0        
  37.2  OUT    7e 7e 01 00  34 00 00 55  aa 00 00 00  00 00 00 00  ....4..U........       232.1.0        
  37.2  OUT    7e 7e 01 00  00 00 00 55  aa 00 00 00  00 00 00 00  .......U........       233.1.0        
  37.2  OUT    7e 7e 01 00  08 00 00 55  aa 00 00 00  00 00 00 00  .......U........       234.1.0        
  37.2  OUT    7e 7e 01 00  f6 00 00 55  aa 00 00 00  00 00 00 00  .......U........       235.1.0        
  37.2  OUT    7e 7e 01 00  15 00 00 55  aa 00 00 00  00 00 00 00  .......U........       236.1.0        
  37.2  OUT    7e 7e 01 00  77 00 00 55  aa 00 00 00  00 00 00 00  ....w..U........       237.1.0        
  37.2  OUT    7e 7e 01 00  00 00 00 55  aa 00 00 00  00 00 00 00  .......U........       238.1.0        
  37.2  OUT    7e 7e 01 00  18 00 00 55  aa 00 00 00  00 00 00 00  .......U........       239.1.0        
  37.2  OUT    7e 7e 01 00  34 00 00 55  aa 00 00 00  00 00 00 00  ....4..U........       240.1.0        
  37.2  OUT    7e 7e 01 00  ff 00 00 55  aa 00 00 00  00 00 00 00  .......U........       241.1.0        
  37.2  OUT    7e 7e 01 00  f7 00 00 55  aa 00 00 00  00 00 00 00  .......U........       242.1.0        
  37.2  OUT    7e 7e 01 00  1a 00 00 55  aa 00 00 00  00 00 00 00  .......U........       243.1.0        
  37.2  OUT    7e 7e 01 00  34 00 00 55  aa 00 00 00  00 00 00 00  ....4..U........       244.1.0        
  37.2  OUT    7e 7e 01 00  00 00 00 55  aa 00 00 00  00 00 00 00  .......U........       245.1.0        
  37.2  OUT    7e 7e 01 00  04 00 00 55  aa 00 00 00  00 00 00 00  .......U........       246.1.0        
  37.2  OUT    7e 7e 01 00  f6 00 00 55  aa 00 00 00  00 00 00 00  .......U........       247.1.0        
  37.2  OUT    7e 7e 01 00  15 00 00 55  aa 00 00 00  00 00 00 00  .......U........       248.1.0        
  37.2  OUT    7e 7e 01 00  77 00 00 55  aa 00 00 00  00 00 00 00  ....w..U........       249.1.0        
  37.2  OUT    7e 7e 01 00  00 00 00 55  aa 00 00 00  00 00 00 00  .......U........       250.1.0        
  37.2  OUT    7e 7e 01 00  18 00 00 55  aa 00 00 00  00 00 00 00  .......U........       251.1.0        
  37.2  OUT    7e 7e 01 00  34 00 00 55  aa 00 00 00  00 00 00 00  ....4..U........       252.1.0        
  37.2  OUT    7e 7e 01 00  ff 00 00 55  aa 00 00 00  00 00 00 00  .......U........       253.1.0        
  37.2  OUT    7e 7e 01 00  fb 00 00 55  aa 00 00 00  00 00 00 00  .......U........       254.1.0        
  37.2  OUT    7e 7e 01 00  1a 00 00 55  aa 00 00 00  00 00 00 00  .......U........       255.1.0        
  37.2  OUT    7e 7e 01 00  34 00 00 55  aa 00 00 00  00 00 00 00  ....4..U........       256.1.0        
  37.2  OUT    7e 7e 01 00  00 00 00 55  aa 00 00 00  00 00 00 00  .......U........       257.1.0        
  37.2  OUT    7e 7e 01 00  08 00 00 55  aa 00 00 00  00 00 00 00  .......U........       258.1.0        
  37.2  OUT    7e 7e 01 00  f6 00 00 55  aa 00 00 00  00 00 00 00  .......U........       259.1.0        
  37.2  OUT    7e 7e 01 00  15 00 00 55  aa 00 00 00  00 00 00 00  .......U........       260.1.0        
  37.2  OUT    7e 7e 01 00  77 00 00 55  aa 00 00 00  00 00 00 00  ....w..U........       261.1.0        
  37.2  OUT    7e 7e 01 00  00 00 00 55  aa 00 00 00  00 00 00 00  .......U........       262.1.0        
  37.2  OUT    7e 7e 01 00  18 00 00 55  aa 00 00 00  00 00 00 00  .......U........       263.1.0        
  37.2  OUT    7e 7e 01 00  34 00 00 55  aa 00 00 00  00 00 00 00  ....4..U........       264.1.0        
  37.2  IN     e7 e7 00 00  0f 02 00 cf  bf 55 aa 00  00 00 00 00  .........U......       265.1.0        
  37.2  OUT    7e 7e 01 00  fd 00 00 55  aa 00 00 00  00 00 00 00  .......U........       266.1.0        
